
*** tstart() called on Edens-MacBook-Air.local
*** at Wed Jul 21 03:28:35 2021

   => Loading Basis Set <=

    Name: STO-3G
    Role: ORBITAL
    Keyword: BASIS
    atoms 1-4 entry H          line    19 file /Users/Eden/opt/anaconda3/envs/quantum-computing/share/psi4/basis/sto-3g.gbs 


         ---------------------------------------------------------
                                   SCF
               by Justin Turney, Rob Parrish, Andy Simmonett
                          and Daniel G. A. Smith
                              RHF Reference
                        1 Threads,    500 MiB Core
         ---------------------------------------------------------

  ==> Geometry <==

    Molecular point group: d2h
    Full point group: D4h

    Geometry (in Angstrom), charge = 0, multiplicity = 1:

       Center              X                  Y                   Z               Mass       
    ------------   -----------------  -----------------  -----------------  -----------------
         H            0.000000000000    -1.200000000000    -1.200000000000     1.007825032230
         H            0.000000000000    -1.200000000000     1.200000000000     1.007825032230
         H           -0.000000000000     1.200000000000    -1.200000000000     1.007825032230
         H           -0.000000000000     1.200000000000     1.200000000000     1.007825032230

  Running in d2h symmetry.

  Rotational constants: A =      2.90395  B =      2.90395  C =      1.45197 [cm^-1]
  Rotational constants: A =  87058.17821  B =  87058.17821  C =  43529.08910 [MHz]
  Nuclear repulsion =    1.193782679545116

  Charge       = 0
  Multiplicity = 1
  Electrons    = 4
  Nalpha       = 2
  Nbeta        = 2

  ==> Algorithm <==

  SCF Algorithm Type is DF.
  DIIS enabled.
  MOM disabled.
  Fractional occupation disabled.
  Guess Type is SAD.
  Energy threshold   = 1.00e-06
  Density threshold  = 1.00e-06
  Integral threshold = 0.00e+00

  ==> Primary Basis <==

  Basis Set: STO-3G
    Blend: STO-3G
    Number of shells: 4
    Number of basis function: 4
    Number of Cartesian functions: 4
    Spherical Harmonics?: true
    Max angular momentum: 0

   => Loading Basis Set <=

    Name: (STO-3G AUX)
    Role: JKFIT
    Keyword: DF_BASIS_SCF
    atoms 1-4 entry H          line    23 file /Users/Eden/opt/anaconda3/envs/quantum-computing/share/psi4/basis/def2-svp-jkfit.gbs 

  ==> Pre-Iterations <==

   -------------------------------------------------------
    Irrep   Nso     Nmo     Nalpha   Nbeta   Ndocc  Nsocc
   -------------------------------------------------------
     Ag         1       1       0       0       0       0
     B1g        0       0       0       0       0       0
     B2g        0       0       0       0       0       0
     B3g        1       1       0       0       0       0
     Au         0       0       0       0       0       0
     B1u        1       1       0       0       0       0
     B2u        1       1       0       0       0       0
     B3u        0       0       0       0       0       0
   -------------------------------------------------------
    Total       4       4       2       2       2       0
   -------------------------------------------------------

  ==> Integral Setup <==

  DFHelper Memory: AOs need 0.000 GiB; user supplied 0.366 GiB. Using in-core AOs.

  ==> MemDFJK: Density-Fitted J/K Matrices <==

    J tasked:                   Yes
    K tasked:                   Yes
    wK tasked:                   No
    OpenMP threads:               1
    Memory [MiB]:               375
    Algorithm:                 Core
    Schwarz Cutoff:           1E-12
    Mask sparsity (%):       0.0000
    Fitting Condition:        1E-10

   => Auxiliary Basis Set <=

  Basis Set: (STO-3G AUX)
    Blend: DEF2-SVP-JKFIT
    Number of shells: 24
    Number of basis function: 72
    Number of Cartesian functions: 80
    Spherical Harmonics?: true
    Max angular momentum: 2

  Minimum eigenvalue in the overlap matrix is 8.8848568028E-01.
  Using Symmetric Orthogonalization.

  SCF Guess: Superposition of Atomic Densities via on-the-fly atomic UHF.

  ==> Iterations <==

                           Total Energy        Delta E     RMS |[F,P]|

   @DF-RHF iter SAD:    -1.09607946795287   -1.09608e+00   0.00000e+00 
   @DF-RHF iter   1:    -1.42495259196985   -3.28873e-01   0.00000e+00 DIIS
   @DF-RHF iter   2:    -1.42495259196985    0.00000e+00   0.00000e+00 DIIS
  Energy and wave function converged.


  ==> Post-Iterations <==

    Orbital Energies [Eh]
    ---------------------

    Doubly Occupied:                                                      

       1Ag    -0.255200     1B1u   -0.187004  

    Virtual:                                                              

       1B2u    0.031174     1B3g    0.090644  

    Final Occupation by Irrep:
             Ag   B1g   B2g   B3g    Au   B1u   B2u   B3u 
    DOCC [     1,    0,    0,    0,    0,    1,    0,    0 ]

  @DF-RHF Final Energy:    -1.42495259196985

   => Energetics <=

    Nuclear Repulsion Energy =              1.1937826795451161
    One-Electron Energy =                  -4.3530617513366163
    Two-Electron Energy =                   1.7343264798216456
    Total Energy =                         -1.4249525919698549

Computation Completed


Properties will be evaluated at   0.000000,   0.000000,   0.000000 [a0]

Properties computed using the SCF density matrix

  Nuclear Dipole Moment: [e a0]
     X:     0.0000      Y:     0.0000      Z:     0.0000

  Electronic Dipole Moment: [e a0]
     X:     0.0000      Y:     0.0000      Z:     0.0000

  Dipole Moment: [e a0]
     X:     0.0000      Y:     0.0000      Z:     0.0000     Total:     0.0000

  Dipole Moment: [D]
     X:     0.0000      Y:     0.0000      Z:     0.0000     Total:     0.0000


*** tstop() called on Edens-MacBook-Air.local at Wed Jul 21 03:28:35 2021
Module time:
	user time   =       0.54 seconds =       0.01 minutes
	system time =       0.03 seconds =       0.00 minutes
	total time  =          0 seconds =       0.00 minutes
Total time:
	user time   =     321.98 seconds =       5.37 minutes
	system time =      71.47 seconds =       1.19 minutes
	total time  =       1042 seconds =      17.37 minutes

         ---------------------------------------------------------
                                   SCF
               by Justin Turney, Rob Parrish, Andy Simmonett
                          and Daniel G. A. Smith
                              RHF Reference
                        1 Threads,    500 MiB Core
         ---------------------------------------------------------

  ==> Geometry <==

    Molecular point group: d2h
    Full point group: D4h

    Geometry (in Angstrom), charge = 0, multiplicity = 1:

       Center              X                  Y                   Z               Mass       
    ------------   -----------------  -----------------  -----------------  -----------------
         H            0.000000000000    -1.200000000000    -1.200000000000     1.007825032230
         H            0.000000000000    -1.200000000000     1.200000000000     1.007825032230
         H           -0.000000000000     1.200000000000    -1.200000000000     1.007825032230
         H           -0.000000000000     1.200000000000     1.200000000000     1.007825032230

  Running in d2h symmetry.

  Rotational constants: A =      2.90395  B =      2.90395  C =      1.45197 [cm^-1]
  Rotational constants: A =  87058.17821  B =  87058.17821  C =  43529.08910 [MHz]
  Nuclear repulsion =    1.193782679545116

  Charge       = 0
  Multiplicity = 1
  Electrons    = 4
  Nalpha       = 2
  Nbeta        = 2

  ==> Algorithm <==

  SCF Algorithm Type is PK.
  DIIS enabled.
  MOM disabled.
  Fractional occupation disabled.
  Guess Type is AUTO.
  Energy threshold   = 1.00e-06
  Density threshold  = 1.00e-06
  Integral threshold = 0.00e+00

  ==> Primary Basis <==

  Basis Set: STO-3G
    Blend: STO-3G
    Number of shells: 4
    Number of basis function: 4
    Number of Cartesian functions: 4
    Spherical Harmonics?: true
    Max angular momentum: 0

