
*** tstart() called on Edens-MacBook-Air.local
*** at Sun Jul 25 21:58:47 2021

   => Loading Basis Set <=

    Name: STO-3G
    Role: ORBITAL
    Keyword: BASIS
    atoms 1-2 entry H          line    19 file /Users/Eden/opt/anaconda3/envs/quantum-computing/share/psi4/basis/sto-3g.gbs 


         ---------------------------------------------------------
                                   SCF
               by Justin Turney, Rob Parrish, Andy Simmonett
                          and Daniel G. A. Smith
                              RHF Reference
                        1 Threads,    500 MiB Core
         ---------------------------------------------------------

  ==> Geometry <==

    Molecular point group: d2h
    Full point group: D_inf_h

    Geometry (in Angstrom), charge = 0, multiplicity = 1:

       Center              X                  Y                   Z               Mass       
    ------------   -----------------  -----------------  -----------------  -----------------
         H            0.000000000000     0.000000000000    -1.300000000000     1.007825032230
         H            0.000000000000     0.000000000000     1.300000000000     1.007825032230

  Running in d2h symmetry.

  Rotational constants: A = ************  B =      4.94874  C =      4.94874 [cm^-1]
  Rotational constants: A = ************  B = 148359.49896  C = 148359.49896 [MHz]
  Nuclear repulsion =    0.203529696411538

  Charge       = 0
  Multiplicity = 1
  Electrons    = 2
  Nalpha       = 1
  Nbeta        = 1

  ==> Algorithm <==

  SCF Algorithm Type is DF.
  DIIS enabled.
  MOM disabled.
  Fractional occupation disabled.
  Guess Type is SAD.
  Energy threshold   = 1.00e-06
  Density threshold  = 1.00e-06
  Integral threshold = 0.00e+00

  ==> Primary Basis <==

  Basis Set: STO-3G
    Blend: STO-3G
    Number of shells: 2
    Number of basis function: 2
    Number of Cartesian functions: 2
    Spherical Harmonics?: true
    Max angular momentum: 0

   => Loading Basis Set <=

    Name: (STO-3G AUX)
    Role: JKFIT
    Keyword: DF_BASIS_SCF
    atoms 1-2 entry H          line    23 file /Users/Eden/opt/anaconda3/envs/quantum-computing/share/psi4/basis/def2-svp-jkfit.gbs 

  ==> Pre-Iterations <==

   -------------------------------------------------------
    Irrep   Nso     Nmo     Nalpha   Nbeta   Ndocc  Nsocc
   -------------------------------------------------------
     Ag         1       1       0       0       0       0
     B1g        0       0       0       0       0       0
     B2g        0       0       0       0       0       0
     B3g        0       0       0       0       0       0
     Au         0       0       0       0       0       0
     B1u        1       1       0       0       0       0
     B2u        0       0       0       0       0       0
     B3u        0       0       0       0       0       0
   -------------------------------------------------------
    Total       2       2       1       1       1       0
   -------------------------------------------------------

  ==> Integral Setup <==

  DFHelper Memory: AOs need 0.000 GiB; user supplied 0.366 GiB. Using in-core AOs.

  ==> MemDFJK: Density-Fitted J/K Matrices <==

    J tasked:                   Yes
    K tasked:                   Yes
    wK tasked:                   No
    OpenMP threads:               1
    Memory [MiB]:               375
    Algorithm:                 Core
    Schwarz Cutoff:           1E-12
    Mask sparsity (%):       0.0000
    Fitting Condition:        1E-10

   => Auxiliary Basis Set <=

  Basis Set: (STO-3G AUX)
    Blend: DEF2-SVP-JKFIT
    Number of shells: 12
    Number of basis function: 36
    Number of Cartesian functions: 40
    Spherical Harmonics?: true
    Max angular momentum: 2

  Minimum eigenvalue in the overlap matrix is 9.5905066776E-01.
  Using Symmetric Orthogonalization.

  SCF Guess: Superposition of Atomic Densities via on-the-fly atomic UHF.

  ==> Iterations <==

                           Total Energy        Delta E     RMS |[F,P]|

   @DF-RHF iter SAD:    -0.54646851627426   -5.46469e-01   0.00000e+00 
   @DF-RHF iter   1:    -0.69147005126248   -1.45002e-01   0.00000e+00 DIIS
   @DF-RHF iter   2:    -0.69147005126248    0.00000e+00   0.00000e+00 DIIS
  Energy and wave function converged.


  ==> Post-Iterations <==

    Orbital Energies [Eh]
    ---------------------

    Doubly Occupied:                                                      

       1Ag    -0.206424  

    Virtual:                                                              

       1B1u    0.041850  

    Final Occupation by Irrep:
             Ag   B1g   B2g   B3g    Au   B1u   B2u   B3u 
    DOCC [     1,    0,    0,    0,    0,    0,    0,    0 ]

  @DF-RHF Final Energy:    -0.69147005126248

   => Energetics <=

    Nuclear Repulsion Energy =              0.2035296964115385
    One-Electron Energy =                  -1.3771517197403433
    Two-Electron Energy =                   0.4821519720663240
    Total Energy =                         -0.6914700512624808

Computation Completed


Properties will be evaluated at   0.000000,   0.000000,   0.000000 [a0]

Properties computed using the SCF density matrix

  Nuclear Dipole Moment: [e a0]
     X:     0.0000      Y:     0.0000      Z:     0.0000

  Electronic Dipole Moment: [e a0]
     X:     0.0000      Y:     0.0000      Z:     0.0000

  Dipole Moment: [e a0]
     X:     0.0000      Y:     0.0000      Z:     0.0000     Total:     0.0000

  Dipole Moment: [D]
     X:     0.0000      Y:     0.0000      Z:     0.0000     Total:     0.0000


*** tstop() called on Edens-MacBook-Air.local at Sun Jul 25 21:58:47 2021
Module time:
	user time   =       0.30 seconds =       0.00 minutes
	system time =       0.02 seconds =       0.00 minutes
	total time  =          0 seconds =       0.00 minutes
Total time:
	user time   =      26.01 seconds =       0.43 minutes
	system time =       6.57 seconds =       0.11 minutes
	total time  =         35 seconds =       0.58 minutes

         ---------------------------------------------------------
                                   SCF
               by Justin Turney, Rob Parrish, Andy Simmonett
                          and Daniel G. A. Smith
                              RHF Reference
                        1 Threads,    500 MiB Core
         ---------------------------------------------------------

  ==> Geometry <==

    Molecular point group: d2h
    Full point group: D_inf_h

    Geometry (in Angstrom), charge = 0, multiplicity = 1:

       Center              X                  Y                   Z               Mass       
    ------------   -----------------  -----------------  -----------------  -----------------
         H            0.000000000000     0.000000000000    -1.300000000000     1.007825032230
         H            0.000000000000     0.000000000000     1.300000000000     1.007825032230

  Running in d2h symmetry.

  Rotational constants: A = ************  B =      4.94874  C =      4.94874 [cm^-1]
  Rotational constants: A = ************  B = 148359.49896  C = 148359.49896 [MHz]
  Nuclear repulsion =    0.203529696411538

  Charge       = 0
  Multiplicity = 1
  Electrons    = 2
  Nalpha       = 1
  Nbeta        = 1

  ==> Algorithm <==

  SCF Algorithm Type is PK.
  DIIS enabled.
  MOM disabled.
  Fractional occupation disabled.
  Guess Type is AUTO.
  Energy threshold   = 1.00e-06
  Density threshold  = 1.00e-06
  Integral threshold = 0.00e+00

  ==> Primary Basis <==

  Basis Set: STO-3G
    Blend: STO-3G
    Number of shells: 2
    Number of basis function: 2
    Number of Cartesian functions: 2
    Spherical Harmonics?: true
    Max angular momentum: 0

